web-scraper-order,web-scraper-start-url,link,link-href,title,date,author,category,image-url,description,keywords,text,processed
1580971205-57,https://www.liputan6.com/tag/perubahan-iklim?type=text&filter=all&page=4,7 dari 10 Bencana di Indonesia Terkait Perubahan Iklim,https://www.liputan6.com/health/read/3963691/7-dari-10-bencana-di-indonesia-terkait-perubahan-iklim,7 dari 10 Bencana di Indonesia Terkait Perubahan Iklim,2019-05-12T17:00:50+07:00,Liputan6.com,News,https://cdn1-production-images-kly.akamaized.net/SqbenCtwh36iowe9Zt9YiaHrlgg=/673x379/smart/filters:quality(75):strip_icc():format(jpeg)/kly-media-production/medias/1588019/original/097014900_1538998899-PG_1.jpg,Bencana di Indonesia lebih banyak terkait perubahan iklim dan upaya mengatasi melalui adaptasi perubahan iklim.,"Bengkulu, Bencana Hidrometeorologi, Perubahan Iklim, Bencana","Liputan6.com, Jakarta Hujan deras yang mengguyur Bengkulu sepanjang Jumat, 26 April 2019 hingga Sabtu, 27 April 2019 mengakibatkan bencana banjir dan tanah longsor. Luapan air banjir memasuki permukiman penduduk. Ribuan warga pun mengungsi. Data Badan Nasional Penanggulangan Bencana (BNPB) menyebut, 29 orang tewas serta 9 orang hilang. Sebagian besar korban tewas dan dan hilang berasal dari Kabupaten Bengkulu tengah, terutama di wilayah Gunung Kumbu.
Kepala Pusat Data Informasi dan Humas BNPB Sutopo Purwo Nugroho pernah menyampaikan, ada beberapa faktor yang menyebabkan banjir di Bengkulu. Faktor tersebut yakni  kombinasi antara alam dan faktor manusia. Faktor alam adanya curah hujan. Bengkulu terdiri atas 19 kabupaten/kota punya hujan sangat ekstrem. Ini mengakibatkan sungai-sungai meluap ditambah dengan kerusakan alam dan lingkungan terjadi.


Baca Juga

Langkah Kemenkes  Antisipasi Bencana Hidroklimatologi Akibat Perubahan Cuaca
KPAI: Materi UN untuk Sekolah Darurat di Wilayah Terdampak Bencana Harus Dibedakan
Saran KPAI agar Edukasi Bencana Tidak Membebani Anak





Faktor lain bencana banjir dan longsor di Bengkulu, yakni kerusakan akibat banyaknya proyek tambang dan juga perumahan. Perubahan penggunaan lahan dari hutan menjadi perkebunan. Kehadiran tambang dan pembangunan perumahan di daerah rawan bencana dan banjir. Curah hujan yang meresap di tanah hanya sedikit karena alih fungsi lahan juga kehadiran tambang.
Ketika hujan, sebagian besar air menjadi aliran permukaan yang mana mencari aliran ke sungai-sungai. Hanya sebagian kecil air hujan yang meresap ke dalam tanah. Contoh bencana banjir dan tanah longsor di Bengkulu termasuk salah satu bencana hidrometeorologi (bencana terkait iklim). Kepala Sub Direktorat Pencegahan dan Kesiapsiagaan BNPB, Berton Panjaitan mengatakan, 7 dari 10 bencana dalam kajian BNPB terkait iklim.
“Banjir, banjir bandang, longsor, kekeringan, cuaca ekstrem, gelombang ekstrem dan abrasi serta kebakaran lahan dan hutan termasuk bencana hidrometeorologi. Tiga bencana lain yang tidak terkait dengan iklim, yaitu gempa bumi, tsunami, dan erupsi gunung berapi. Ketiga bencana ini terkait bencana geologi,” jelas Berton dalam pemaparan yang diterima Health Liputan6.com, ditulis Minggu (12/5/2019).
Berdasarkan Data Informasi Bencana Indonesia (DIBI)-BNPB periode 2005-2017, kejadian bencana di Indonesia memang lebih banyak terkait hidrometeorologi. Pada tahun 2016, kejadian bencana hidrometeorologi sebanyak 2.287 kejadian, sedangkan bencana geologi sebanyak 26 kejadian. Pada tahun 2017, ada 2.139 kejadian bencana hidrometeorologi dan 18 kejadian bencana geologi.2 dari 5 halamanIndonesia rawan bencanaBanjir terparah terjadi di Kota Bengkulu dan Kabupaten Kepahiang, terlihat aparat TNI Angkatan Laut elakukan evakuasi warga (Liputan6.com/Yuliardi Hardjo)Adanya kejadian bencana hidrometeorologi yang lebih banyak terjadi di Tanah Air menjadi bukti kuat Indonesia termasuk salah satu negara di dunia yang rawan bencana. Indonesia rentan terhadap bencana. Dalam World Risk Report 2016, Indonesia dikategorikan sebagai negara dengan risiko bencana tinggi. 
Direktur Adaptasi Perubahan Iklim Kementerian Lingkungan Hidup dan Kehutanan RI, Sri Tantri Arundhati menjelaskan, kategori kerentanan nasional dilihat dari kondisi seluruh wilayah Indonesia. Data berasal dari Pendataan Potensi Desa (Podes) 2014.
“74 persen wilayah Indonesia masuk kategori ‘cukup rentan.’ Kemudian 10 persen wilayah ‘tidak rentan’, 9 persen wilayah ‘agak rentan’,  4 persen wilayah ‘rentan’ terhadap bencana. 3 persen wilayah Indonesia bahkan masuk kategori ‘sangat rentan,” papar Tantri sebagaimana tertulis dalam pemaparan presentasinya.
Faktor perubahan iklim (temperatur suhu) dan permukaan suhu air laut memengaruhi kerentanan Indonesia terhadap bencana hidrometeorologi. Di luar skenario terbutuk (RCP8,5), kenaikan suhu rata-rata Indonesia diproyeksikan di bawah 2 derajat Celcius, menurut data Indonesia National Communication 2016.
Namun, perlu dicatat penyebaran  proyeksi  iklim  mengandung  ketidakpastian  (uncertainty). Dalam perhitungan kenaikan tertinggi suhu  rata-rata proyeksi  di  Indonesia  berpotensi  mencapai  nilai  yang sama  seperti  pada  rentang temperatur  global  pada  tahun  2100,  yaitu  lebih  dari 4 derajat Celcius. Proyeksi perubahan suhu air laut, hasil model Regional Ocean Modeling Systems (ROMS) tahun 2006 sampai 2040 menunjukkan, suhu Permukaan Laut (SPL) berubah dengan cepat dengan rata-rata SPL regional naik lebih dari 0,25 derajat Celcius per dekade.
Hasil proyeksi ini relatif sesuai dengan pengamatan menggunakan data satelit dan data direkonstruksi. Tingkat kenaikan SPL tertinggi kemungkinan akan terjadi di Laut Tiongkok Selatan dan Selat Karimata yang mencapai 0,5 derajat Celcius per dekade.
”Tingkat kenaikan SPL di Laut Jawa, Laut Banda, Laut Sulawesi, dan laut sekitarnya berkisar antara 0,2 hingga 0,3 derajat Celcius per dekade. Sementara itu, tren kenaikan (permukaan suhu air laut) di Pasifik, bagian utara Papua mungkin menjadi yang terendah dibandingkan dengan tingkat kenaikan di daerah lain,” Tantri melanjutkan.
Anomali curah hujan juga menjadi faktor Indonesia rawan bencana. Hal ini terlihat tidak hanya dari kejadian bencana selama kurun waktu Pada  periode 2026-2050,  anomali  curah  hujan  bulanan  melebihi  200 mm per bulan  diproyeksikan  meningkat  di  beberapa  wilayah,  seperti Kalimantan  dan  Sulawesi. Potensi kenaikan curah hujan diproyeksikan  akan  terus  meningkat  pada tahun 2051-2075  dan  2076-2100. Kenaikan ini seiring  peningkatan  ketidakpastian perubahan anomali curah hujan di masa depan.3 dari 5 halamanPeningkatan ancaman bencanaPolisi dan warga sekitar mencari korban musibah tanah longsor di Dusun Cimapag, Sirnaresmi, Cisolok, Sukabumi, Jawa Barat, Selasa (1/1). Sebanyak 38 warga belum ditemukan dan masih dalam proses pencarian. (Merdeka.com/Arie Basuki)Dalam buku Rencana Nasional Penanggulangan Bencana 2015-2019 yang diterbitkan BNPB, Peningkatan ancaman bencana terkait iklim dan geologi dipengaruhi beberapa faktor.
Pertama, fenomena geologi yang semakin dinamis. Fenomena geologi sangat terkait dengan terjadinya ancaman bencana dan termasuk faktor yang sulit diprediksi. Contohnya saat terjadi erupsi Gunung Sinabung. Erupsi gunung api yang berlokasi di Dataran Tinggi Karo, Kabupaten Karo, Sumatra Utara terjadi setelah tidak terdapat aktivitas selama 1.200 tahun.
Selain itu, pengangkatan bagian selatan pulau Jawa dan penurunan di bagian utaranya yang berpotensi terjadi banjir dan rob bisa sulit diprediksi. Kedua, perubahan iklim yang semakin ekstrem. Perubahan iklim yang terjadi di Indonesia cenderung semakin ekstrem. Dampak sudah terlihat di antaranya, beberapa pulau kecil di Indonesia bagian timur yang makin mengecil luasnya atau bahkan hilang.
Yang sekarang kian dirasakan juga semakin tidak pastinya musim hujan dan kemarau. Masa peralihan musim, baik dari musim hujan ke musim kemarau atau sebaliknya bisa berujung terjadinya banjir, tanah longsor, dan kekeringan. Ketiga, degradasi lingkungan yang kian meningkat. Degradasi ini merupakan dampak pembangunan yang tidak terkendali. Pemenuhan lahan terkait kebutuhan permukiman, pertambangan, dan pembangunan juga semakin bertambah.
Pemanfaatan lahan yang tidak terkendali dan menyimpang dari tata ruang yang disepakati mengakibatkan meningkatnya degradasi lingkungan yang akan menambah ancaman bencana di masa mendatang. Keempat, bonus demografi yang tidak terkontrol. Adanya bonus demografi termasuk hal yang patut disyukuri. Tetapi harus dikelola dengan baik. Apabila tidak maka akan berkontribusi terhadap peningkatan ancaman bencana terkait antropogenik (aktivitas manusia).
Adapun contoh bencana terkait antropogenik, yakni kebakaran hutan dan longsor. Longsor yang terjadi di di Kampung Cimapag, Desa Sirnaresmi, Kecamatan Cisolok, Kabupaten Sukabumi, Jawa Barat pada 31 Desember 2018 termasuk bencana antropogenik dan hidrometeorologi. Alih fungsi di lokasi atau bukit mahkota longsor memiliki kemiringan lereng, tanah mudah menyerap air, gembur dan mudah longsor. Di tambah lagi kawasan yang seharusnya dikonservasi menjadi zona budidaya.
Selain itu, wilayah yang terjadi longsor lantaran fungsinya sudah dialihkan oleh masyarakat setempat. Sutopo menyebut, wilayah tersebut sejatinya adalah kawasan konservasi bukan budi daya. Curah hujan tinggi dengan kemiringan lereng dan terjal lebih dari 30 persen. Kemudian tanah bersifat poros artinya mudah menyerap air. Gembur mudah sekali longsor,4 dari 5 halamanAdaptasi perubahan iklimMusim kemarau baru berlangsung 1-2 bulan ini, tapi permukaan air Danau Limboto sudah menyurut 200-300 meter. (Liputan6.com/Arfandi Ibrahim)Berton menekankan, dalam konteks bencana, perubahan iklim memiliki ancaman ganda. Pertama, meningkatkan frekuensi dan intensitas bahaya terkait iklim. Bahaya terkait iklim meliputi musim kering yang panjang, banjir, cuaca ekstrem, tanah longsor, dan kebakaran hutan. Kedua, meningkatkan kerentanan melalui degradasi ekosistem, yang menyebabkan menurunnya daya dukung lingkungan. Hal ini dapat berdampak terhadap kehidupan masyarakat
Untuk mengurangi dampak bencana terkait iklim diperlukan upaya adaptasi perubahan iklim. Upaya ini untuk mendorong pemangku kepentingan, baik pemerintah, swasta, lembaga, dan masyarakat untuk mengambil langkah nyata adaptasi perubahan iklim. Yang paling utama, bagaimana mempersiapkan diri dari dampak perubahan iklim yang semakin nyata. 
“Dalam menyikapi perubahan iklim, konvergensi adaptasi perubahan iklim dan pengurangan risiko bencana adalah keharusan. Konvergensi ini menjadi langkah strategis dalam melakukan pencegahan dan mitigasi bencana. Ketahanan masyarakat melindungi kehidupan dan penghidupannya juga bisa ditingkatkan,” ungkap Berton.
Langkah-langkah pengurangan risiko bencana yang sudah dan terus dilakukan BNPB meliputi identifikasi risiko melalui pemetaan risiko, bahaya atau ancaman, dan analisis kerentanan per wilayah Indonesia. Pemetaan dan analisis kerentanan didukung proyeksi dampak iklim. Masyarakat juga perlu diberikan kesadaran melalui edukasi Mitigasi Bencana dan Perubahan Iklim berbasis sektor Pendidikan (Program SPAB). Edukasi mitigasi bencana terkait pengetahuan bagaimana tanggap bencana.
Seperti halnya di Jepang, anak-anak TK dan SD sudah dilatih untuk tanggap bencana. Di Indonesia, mitigasi bencana bisa dengan mengunjungi diorama BNPB, gedung logistik dan peralatan, perpustakaan, serta ruang simulator gempa BNPB. Tantri menambahkan, adaptasi ketahanan iklim perlu dilakukan dengan pembangunan rendah karbon.
“Jadi, bagaimana kita menerapkan pembangunan dengan pendekatan lanskap (bentang alam). Misal, dipertimbangkan kembali soal konservasi dan restorasi ekosistem. Pembangunan yang dilakukan  juga dipikirkan bagaimana perlindungan kawasan pesisir, dan pengelolaan daerah aliran sungai terintegrasi,” jelasnya.
Yang menjadi tantangan adaptasi perubahan iklim adalah koordinasi. Perubahan iklim merupakan isu lintas sektoral sehingga diperlukan fungsi koordinasi yang kuat. Perhatian dan tuntutan masyarakat terhadap kualitas lingkungan yang bersih dan sehat sehingga mendorong strategi untuk menurunkan emisi gas rumah kaca.5 dari 5 halamanSimak video menarik berikut ini:Duke dan Duchess of Sussex melanjutkan tur mereka di Fiji pada hari Rabu dengan kunjungan ke universitas untuk mengamati kinerja budaya tentang perubahan iklim dan untuk bertemu para siswa.Selanjutnya: Indonesia rawan bencana",jakarta hujan deras guyur bengkulu jumat april sabtu april akibat bencana banjir tanah longsor luap air banjir pasuk mukim duduk ribu warga ungsi data badan nasional tanggulang bencana bnpb orang tewas orang hilang korban tewas hilang kabupaten bengkulu utama wilayah gunung kumbu kepala pusat data informasi humas bnpb sutopo purwo nugroho faktor banjir bengkulu faktor kombinasi alam faktor manusia faktor alam curah hujan bengkulu hujan ekstrem akibat luap rusa alam lingkung baca langkah kemenkes antisipasi bencana hidroklimatologi akibat ubah cuaca kpai materi un sekolah darurat wilayah dampak bencana beda saran kpai edukasi bencana beban anak faktor bencana banjir longsor bengkulu rusa akibat proyek tambang rumah ubah lahan hutan kebun hadir tambang bangun rumah daerah rawan bencana banjir curah hujan resap tanah alih fungsi lahan hadir tambang hujan air alir muka cari alir air hujan resap tanah contoh bencana banjir tanah longsor bengkulu masuk salah bencana hidrometeorologi bencana kait iklim kepala sub direktorat cegah kesiapsiagaan bnpb ton panjaitan bencana kaji bnpb kait iklim banjir banjir bandang longsor kering cuaca ekstrem gelombang ekstrem abrasi bakar lahan hutan masuk bencana hidrometeorologi bencana kait iklim gempa bumi tsunami erupsi gunung rap bencana kait bencana geologi ton papar terima health tulis minggu dasar data informasi bencana indonesia dibi periode bencana indonesia kait hidrometeorologi bencana hidrometeorologi bencana geologi bencana hidrometeorologi bencana halamanindonesia rawan bencanabanjir parah kota bengkulu kabupaten kepahiang lihat aparat tni angkat laut elakukan evakuasi warga hardjo bencana hidrometeorologi tanah air bukti kuat indonesia masuk salah negara dunia rawan bencana indonesia rentan hadap bencana world risk report indonesia kategori negara risiko bencana direktur adaptasi ubah iklim menteri lingkung hidup hutan ri sri tantri arundhati kategori rentan nasional lihat kondisi wilayah indonesia data data potensi desa podes persen wilayah indonesia masuk kategori persen wilayah rentan persen wilayah rentan persen wilayah rentan hadap bencana persen wilayah indonesia masuk kategori rentan papar tantri tulis papar presentasi faktor ubah iklim temperatur suhu muka suhu air laut pengaruh rentan indonesia hadap bencana hidrometeorologi skenario terbutuk suhu indonesia proyeksi derajat celcius data indonesia national communication catat sebar proyeksi iklim kandung ketidakpastian uncertainty hitung suhu proyeksi indonesia potensi capai nilai rentang temperatur global derajat celcius proyeksi ubah suhu air laut hasil model regional ocean modeling systems roms suhu muka laut spl ubah cepat spl regional derajat celcius dekade hasil proyeksi relatif sesuai data satelit data rekonstruksi tingkat spl laut tiongkok selatan selat karimata capai derajat celcius dekade tingkat spl laut jawa laut banda laut sulawesi laut kisar derajat celcius dekade tren muka suhu air laut pasifik utara papua rendah banding tingkat daerah tantri anomali curah hujan faktor indonesia rawan bencana lihat bencana kurun periode anomali curah hujan mm proyeksi tingkat wilayah kalimantan sulawesi potensi curah hujan proyeksi tingkat iring tingkat ketidakpastian ubah anomali curah hujan halamanpeningkatan ancam bencanapolisi warga cari korban musibah tanah longsor dusun cimapag sirnaresmi cisolok sukabumi jawa barat selasa warga temu proses cari basuki buku rencana nasional tanggulang bencana terbit bnpb tingkat ancam bencana kait iklim geologi pengaruh faktor fenomena geologi dinamis fenomena geologi kait ancam bencana masuk faktor sulit prediksi contoh erupsi gunung sabung erupsi gunung api lokasi datar karo kabupaten karo sumatra utara aktivitas angkat selatan pulau jawa turun utara potensi banjir rob sulit prediksi ubah iklim ekstrem ubah iklim indonesia cenderung ekstrem dampak lihat pulau indonesia timur luas hilang kian musim hujan kemarau alih musim musim hujan musim kemarau ujung banjir tanah longsor kering degradasi lingkung kian tingkat degradasi rupa dampak bangun kendali penuh lahan kait butuh mukim tambang bangun manfaat lahan kendali simpang tata ruang pakat akibat tingkat degradasi lingkung ancam bencana bonus demografi kontrol bonus demografi masuk patut syukur kelola kontribusi hadap tingkat ancam bencana kait antropogenik aktivitas manusia contoh bencana kait antropogenik bakar hutan longsor longsor kampung cimapag desa sirnaresmi camat cisolok kabupaten sukabumi jawa barat desember masuk bencana antropogenik hidrometeorologi alih fungsi lokasi bukit mahkota longsor milik miring lereng tanah mudah serap air gembur mudah longsor kawasan konservasi zona budidaya wilayah longsor lantar fungsi alih masyarakat sutopo wilayah sejati kawasan konservasi budi daya curah hujan miring lereng terjal persen tanah sifat poros arti mudah serap air gembur mudah halamanadaptasi ubah iklimmusim kemarau langsung muka air danau limboto surut meter ibrahim ton tekan konteks bencana ubah iklim milik ancam ganda tingkat frekuensi intensitas bahaya kait iklim bahaya kait iklim liput musim kering banjir cuaca ekstrem tanah longsor bakar hutan tingkat rentan degradasi ekosistem turun daya dukung lingkung dampak hadap hidup masyarakat dampak bencana kait iklim upaya adaptasi ubah iklim upaya dorong mang perintah swasta lembaga masyarakat ambil langkah nyata adaptasi ubah iklim utama dampak ubah iklim nyata sikap ubah iklim konvergensi adaptasi ubah iklim risiko bencana konvergensi langkah strategis laku cegah mitigasi bencana tahan masyarakat lindung hidup hidup tingkat ton risiko bencana laku bnpb liput identifikasi risiko meta risiko bahaya ancam analisis rentan wilayah indonesia meta analisis rentan dukung proyeksi dampak iklim masyarakat sadar edukasi mitigasi bencana ubah iklim bas sektor didik program spab edukasi mitigasi bencana kait tanggap bencana jepang tk sd latih tanggap bencana indonesia mitigasi bencana unjung diorama bnpb gedung logistik alat pustaka ruang simulator gempa bnpb tantri adaptasi tahan iklim laku bangun rendah karbon terap bangun lanskap bentang alam timbang konservasi restorasi ekosistem bangun laku pikir lindung kawasan pesisir kelola daerah alir sungai integrasi tantang adaptasi ubah iklim koordinasi ubah iklim rupa isu lintas sektoral fungsi koordinasi kuat perhati tuntut masyarakat hadap kualitas lingkung bersih sehat dorong strategi turun emisi gas rumah halamansimak video tarik duke duchess of sussex tur fiji rabu kunjung universitas kerja budaya ubah iklim temu indonesia rawan bencana
