web-scraper-order,web-scraper-start-url,link,link-href,title,date,author,category,image-url,description,keywords,text,processed
1580970523-1,https://www.liputan6.com/tag/perubahan-iklim?type=text&filter=all&page=4,"Bertemu Pangeran Charles Bahas Perubahan Iklim, Trump Sebut AS Bersih",https://www.liputan6.com/global/read/3983906/bertemu-pangeran-charles-bahas-perubahan-iklim-trump-sebut-as-bersih,"Bertemu Pangeran Charles Bahas Perubahan Iklim, Trump Sebut AS Bersih",2019-06-05T17:00:01+07:00,Liputan6.com,News,https://cdn1-production-images-kly.akamaized.net/ABKiNqaNTCwUOmLxf0wRg6-xArk=/673x379/smart/filters:quality(75):strip_icc():format(jpeg)/kly-media-production/medias/1554266/original/057885800_1491139489-Italy_Royal_Tour_to_E_Hand.jpg,Donald Trump memberi tahu Pangeran Charles bahwa Amerika Serikat 'bersih' dalam perubahan iklim. Apa maksudnya?,"Sains, Perubahan Iklim, Inggris, Amerika Serikat, Pangeran Charles, Donald Trump","Liputan6.com, London - Pangeran Charles menghabiskan 75 menit lebih lama dari yang dijadwalkan untuk meyakinkan Donald Trump tentang bahaya perubahan iklim, tetapi presiden ke-45 Amerika Serikat itu masih bersikeras bahwa AS ""bersih"" dan menyalahkan negara-negara lain atas krisis tersebut.
Sebelumnya, Trump mengatakan dalam sebuah sesi wawancara eksklusif bersama ITV, Good Morning Britain, ia akan bertemu Charles selama 15 menit dalam lawatannya ke Inggris.

Baca Juga
VIDEO: Detik-Detik Trump Tak Respon Jabat Tangan Ketua DPR AS



Namun kenyataannya, pertemuan mereka justru berlangsung selama 90 menit, di mana Pangeran Charles justru menjadi pihak yang mendominasi pembicaraan ini.
Donald Trump berkata: ""Dia (Charles) benar-benar menyinggung soal perubahan iklim dan saya pikir itu hebat. Apa yang sebenarnya dia inginkan dan apa yang benar-benar dia rasakan adalah tentang masa depan. Dia ingin memastikan generasi penerus bisa mewarisi iklim yang baik, yang jauh dari bencana, dan saya setuju.""
Meski demikian, Trump mengatakan bahwa Charles menekan dia dan menyarankan agar AS harus berbuat lebih banyak terkait pencegahan perubahan iklim.
""Saya menyampaikan pada Charles, 'Ya, Amerika Serikat saat ini punya iklim paling bersih yang didasarkan pada semua statistik', dan saya setuju dengan itu bahwa kita menginginkan air terbaik, air terbersih. Harus bersih sebening kristal,"" Trump melanjutkan, seperti dikutip dari The Guardian, Rabu (5/6/2019).
""China, India, Rusia, dan banyak negara lain, mereka tidak memiliki udara yang bagus, kualitas air yang jelek, dan polusi bertebaran di mana-mana. Jika Anda pergi ke kota-kota tertentu ... Anda bahkan tidak bisa bernafas, dan sekarang udara sudah jadi panas,"" lanjutnya.
Saat ditanya oleh jurnalis Piers Morgan soal perubahan iklim dan sains yang terkait dengan ini, Donald Trump menjawab: ""Saya percaya ada perubahan cuaca. Jangan lupa, dulu disebut pemanasan global, tapi itu hanya isapan jempol semata, oleh karenanya sekarang diubah namanya jadi perubahan iklim. Kini anggap saja itu hanya cuaca ekstrem.""
 2 dari 3 halamanDonald Trump - PM Inggris Bahas Isu Brexit, Huawei, hingga IranPresiden AS, Donald Trump dan PM Inggris, Theresa May di London (4/6/2019) (Ben Stansall / AFP PHOTO)Presiden Donald Trump mengatakan Amerika Serikat berkomitmen untuk mencapai ""kesepakatan perdagangan yang fenomenal"" dengan Inggris, selagi Britania Raya menyiapkan diri untuk meninggalkan Uni Eropa.
Di sisi lain, Perdana Menteri Theresa May memuji hubungan antara kedua negara, tetapi mengakui adanya beberapa perbedaan terkait perubahan iklim dan Iran.
Keduanya berbicara kepada wartawan di London usai melaksanakan pertemuan bilateral tingkat tinggi di London pada Selasa 4 Juni 2019 waktu lokal.
Berbicara dalam konferensi pers, Donald Trump mengatakan bahwa Theresa May ""telah melakukan pekerjaan yang sangat baik"" dalam negosiasi Brexit --sebuah komentar yang bertentangan dengan keadaan di mana proposal Brexit versi May terus menjadi perdebatan di Parlemen Inggris hingga saat ini. Dan hal itu pula yang memicu rencana pengunduran diri sang perdana menteri dari jabatannya.
Trump tetap optimis bahwa ""Brexit akan terjadi dan seharusnya harus terjadi ... karena Inggris adalah negara hebat dan ingin identitasnya sendiri,"" demikian seperti dikutip dari BBC, Rabu, 5 Juni 2019.
Perdana Menteri May mengatakan Inggris dan Amerika Serikat dapat memperluas kemitraan ekonomi dengan kesepakatan perdagangan bilateral, dan bahwa pemerintahnya percaya akan perlunya ""menjaga pasar tetap bebas, adil dan terbuka.""
Presiden AS mengatakan ""semuanya ada di atas meja"" dalam diskusi mendatang antara kedua negara, menambahkan bahwa kesepakatan perdagangan ""fenomenal"" akan tercapai.
Geo-politik
Pada isu Iran, Inggris dan AS menyetujui potensi ancaman dari Negeri Para Mullah, tetapi tidak setuju dengan solusinya, dan AS harus ""melakukan segalanya untuk menghindari eskalasi yang tidak menjadi perhatian siapa pun,"" kata May, yang mungkin merujuk pada peningkatan pengaruh dan kehadiran militer AS di Timur Tengah.
Sementara Donald Trump mengatakan bahwa baik AS dan Inggris ""bertekad untuk memastikan bahwa Iran tidak pernah mengembangkan senjata nuklir dan berhenti mendukung dan terlibat dalam terorisme.""
Kedua negara juga akan mencapai kesepakatan untuk melindungi kerja sama berbagi intelijen. Akan tetapi, hal itu terganjal oleh isu Huawei --perusahaan infrastruktur internet dari China yang disebut akan meneken kerja sama teknologi 5G dengan Inggris, namun menurut AS mengandung berisiko terhadap keamanan nasional.3 dari 3 halamanDiwarnai Protes Massa dan Kritik OposisiDemonstran Pro-Trump dan Anti-Trump adu mulut di lokasi aksi massa di London saat kunjungan kenegaraan Presiden AS Donald Trump (3/6/2019) (AP PHOTO)Selagi kedua tokoh itu berbicara pada sebuah konferensi pers bersama, ribuan pengunjuk rasa turun ke jalan di London. Para demonstran membawa berbagai plakat dan meneriakkan slogan-slogan anti-Trump, sementara boneka Trump dalam bentuk balon raksasa melayang di dekat mereka.
Ketika ditanya tentang protes yang sedang berlangsung, Trump menepiskannya sebagai ""berita palsu"" dan mengatakan dia belum melihat demonstrasi-demonstasi seperti yang ditanyakan itu.
Pemimpin Partai Buruh dan oposisi pemerintah di Parlemen Inggris, Jeremy Corbyn hadir dan berorasi pada demonstrasi tersebut. Ia didukung dengan anggota partai politik lainnya, termasuk Demokrat Liberal dan Partai Hijau.
Pemimpin Partai Buruh telah mengusulkan pembicaraan dengan Trump, dengan juru bicara mengatakan dia siap untuk terlibat dengan presiden AS tentang masalah-masalah seperti perubahan iklim, ancaman terhadap perdamaian dan krisis pengungsi - tetapi ini ditolak oleh sang presiden ke-45.
Ketika ditanya tentang pemimpin Partai Buruh, presiden AS mengatakan dia ""tidak mengenalnya, tidak pernah bertemu dengannya, tidak pernah berbicara dengannya"", menambahkan: ""Dia ingin bertemu hari ini atau besok dan saya memutuskan saya tidak akan melakukan itu.""
Trump berkata: ""Saya benar-benar tidak suka kritik sebanyak yang saya suka dan menghormati orang-orang yang melakukan sesuatu.""
Namun, ia kemudian mengatakan kepada Piers Morgan dalam sebuah wawancara untuk Good Morning Britain bahwa ia akan ""tidak ada masalah"" dengan bertemu Corbyn lain kali.Selanjutnya: Donald Trump - PM Inggris Bahas Isu Brexit, Huawei, hingga Iran",london pangeran charles habis menit jadwal donald trump bahaya ubah iklim presiden amerika serikat sikeras as bersih salah krisis trump buah sesi wawancara eksklusif itv good morning britain temu charles menit lawat inggris baca video trump respon jabat tangan ketua dpr as nyata temu langsung menit pangeran charles dominasi bicara donald trump charles singgung ubah iklim pikir hebat generasi waris iklim bencana tuju trump charles tekan saran as kait cegah ubah iklim charles amerika serikat iklim bersih dasar statistik tuju air air bersih bersih bening kristal trump kutip the guardian rabu china india rusia negara milik udara bagus kualitas air jelek polusi tebar pergi nafas udara panas jurnalis piers morgan ubah iklim sains kait donald trump percaya ubah cuaca lupa panas global isap jempol ubah nama ubah iklim anggap cuaca ekstrem halamandonald trump pm inggris bahas isu brexit huawei iranpresiden as donald trump pm inggris theresa may london ben stansall afp photo presiden donald trump amerika serikat komitmen capai sepakat dagang fenomenal inggris selagi britania raya tinggal uni eropa sisi perdana menteri theresa may puji hubung negara beda kait ubah iklim iran bicara wartawan london laksana temu bilateral tingkat london selasa juni lokal bicara konferensi pers donald trump theresa may laku kerja negosiasi brexit buah komentar proposal brexit versi may debat parlemen inggris picu rencana undur sang perdana menteri jabat trump optimis brexit inggris negara hebat identitas kutip bbc rabu juni perdana menteri may inggris amerika serikat luas mitra ekonomi sepakat dagang bilateral perintah percaya jaga pasar bebas adil buka presiden as meja diskusi negara sepakat dagang fenomenal capai isu iran inggris as tuju potensi ancam negeri mullah tuju solusi as laku hindar eskalasi perhati may rujuk tingkat pengaruh hadir militer as timur donald trump as inggris tekad iran kembang senjata nuklir henti dukung libat terorisme negara capai sepakat lindung kerja intelijen ganjal isu huawei usaha infrastruktur internet china teken kerja teknologi inggris as kandung risiko hadap aman halamandiwarnai protes massa kritik oposisidemonstran adu mulut lokasi aksi massa london kunjung negara presiden as donald trump ap photo selagi tokoh bicara buah konferensi pers ribu unjuk turun jalan london demonstran bawa plakat teriak boneka trump bentuk balon raksasa layang protes langsung trump tepis berita palsu lihat pimpin partai buruh oposisi perintah parlemen inggris jeremy corbyn hadir orasi demonstrasi dukung anggota partai politik masuk demokrat liberal partai hijau pimpin partai buruh usul bicara trump juru bicara libat presiden as ubah iklim ancam hadap damai krisis ungsi tolak sang presiden pimpin partai buruh presiden as kenal temu bicara temu besok putus laku trump suka kritik suka hormat laku piers morgan buah wawancara good morning britain temu corbyn donald trump pm inggris bahas isu brexit huawei iran
1580970549-2,https://www.liputan6.com/tag/perubahan-iklim?type=text&filter=all&page=3,"Tangkal Perubahan Iklim, Ethiopia Tanam 350 Juta Pohon dalam Sehari",https://www.liputan6.com/global/read/4025547/tangkal-perubahan-iklim-ethiopia-tanam-350-juta-pohon-dalam-sehari,"Tangkal Perubahan Iklim, Ethiopia Tanam 350 Juta Pohon dalam Sehari",2019-07-31T08:52:03+07:00,Liputan6.com,News,https://cdn0-production-images-kly.akamaized.net/dmPKb6t6hZmrhahloqoKRkDCN94=/673x379/smart/filters:quality(75):strip_icc():format(jpeg)/kly-media-production/medias/2867979/original/048956500_1564480943-tanaman.jpg,Pemerintah Ethiopia menanam lebih dari 350 juta bibit pohon sebagai upaya menangkal perubahan iklim.,"Perubahan Iklim, Ethiopia","Liputan6.com, Addis Ababa - Sekitar 350 juta pohon telah ditanam dalam satu hari di Ethiopia, menurut seorang menteri pemerintah setempat pada Senin 29 Juli.
Penanaman tersebut merupakan bagian dari inisiatif nasional bertajuk ""Warisan Hijau"", yang bertujuan menumbuhkan 4 miliar pohon di Ethiopia pada musim panas ini, demikian sebagaimana dikutip dari The Guardian pada Selasa (30/7/2019).


Baca Juga

Ibu Kota Ethiopia Resmi Haramkan Motor, Tapi...
Dugaan Upaya Kudeta di Ethiopia, Gubernur dan Kastaf Militer Tewas
28 Ekor Kuda Nil Mati Secara Misterius di Taman Nasional Ethiopia





Pemerintah Ethiopia mendorong setiap warga negaranya untuk menanam setidaknya 40 bibit pohon.
Kantor-kantor publik bahkan diliburkan agar para pegawai negeri sipil turut sertra dalam inisiatif hijau tersebut.
Proyek ini bertujuan untuk mengatasi dampak deforestasi dan perubahan iklim di negara yang rawan kekeringan.
Menurut PBB, tutupan hutan Ethiopia hanya 4 persen di tahun 2000-an, turun dari 35 persen seabad sebelumnya.2 dari 2 halamanMemiliki Banyak ManfaatIlustrasi (iStock)Menteri inovasi dan teknologi Ethiopia, Dr Getahun Mekuria, mengetwit estimasi jumlah pohon yang ditanam sepanjang hari itu, di mana menjelang petang, total yang tercatat adalah sebanyak 353 juta bibit.
Rekor dunia sebelumnya untuk pohon terbanyak yang ditanam dalam satu hari mencapai 50 juta bibit, dipegang oleh India sejak 2016.
Dr Dan Ridley-Ellis, kepala pusat sains dan teknologi kayu di University of Edinburgh Napier, Inggris, mengatakan: ""Pohon tidak hanya membantu mengurangi perubahan iklim dengan menyerap karbon dioksida di udara, tetapi mereka juga memiliki manfaat besar dalam memerangi penggurunan dan degradasi lahan, khususnya di negara-negara kering.""
""Pohon-pohon juga menyediakan makanan, tempat tinggal, bahan bakar, pakan ternak, obat-obatan, dan perlindungan pasokan air bersih,"" lanjutnya mengingatkan.
Ditambahkan oleh Ridley-Ellis, bahwa prestasi yang mengesankan oleh pemerintah Ethiopia bukan hanya soal menanam pohon, tetapi bagian dari tantangan besar dan rumit untuk memperhitungkan kebutuhan berbagai jangka waktu dari hubungan antara lingkungan dan manusia.
""Mantra rimbawan 'pohon yang tepat di tempat yang tepat' menuntut pertimbangan lebuh dalam tentang efek perubahan iklim, serta dimensi ekologis, sosial, budaya dan ekonomi,"" pungkas Ridley-Ellis.
 
Simak video pilihan berikut:Perdana Menteri Jepang Shinzo Abe juga menegaskan pentingnya penggunaan teknologi digital dalam mendukung efektifitas pemerintahan dan kegiatan ekonomi.Selanjutnya: Memiliki Banyak Manfaat",addis ababa juta pohon tanam ethiopia orang menteri perintah senin juli tanam rupa inisiatif nasional tajuk waris hijau tuju tumbuh miliar pohon ethiopia musim panas kutip the guardian selasa baca kota ethiopia resmi haram motor duga upaya kudeta ethiopia gubernur kastaf militer tewas ekor kuda nil mati misterius taman nasional ethiopia perintah ethiopia dorong warga negara tanam bibit pohon publik libur pegawai negeri sipil sertra inisiatif hijau proyek tuju dampak deforestasi ubah iklim negara rawan kering pbb tutup hutan ethiopia persen turun persen abad halamanmemiliki manfaatilustrasi istock menteri inovasi teknologi ethiopia dr getahun mekuria mengetwit estimasi pohon tanam jelang petang total catat juta bibit rekor dunia pohon tanam capai juta bibit pegang india dr kepala pusat sains teknologi kayu university of edinburgh napier inggris pohon bantu ubah iklim serap karbon dioksida udara milik manfaat rang gurun degradasi lahan khusus kering sedia makan tinggal bahan bakar pakan ternak lindung pasok air bersih prestasi kesan perintah ethiopia tanam pohon tantang rumit hitung butuh jangka hubung lingkung manusia mantra rimbawan tuntut timbang lebuh efek ubah iklim dimensi ekologis sosial budaya ekonomi pungkas simak video pilih perdana menteri jepang shinzo abe teknologi digital dukung efektifitas perintah giat milik manfaat
1580970562-3,https://www.liputan6.com/tag/perubahan-iklim?type=text&filter=all&page=3,Palembang Jadi Pilot Project Rencana Aksi Perubahan Iklim,https://www.liputan6.com/regional/read/4053153/palembang-jadi-pilot-project-rencana-aksi-perubahan-iklim,Palembang Jadi Pilot Project Rencana Aksi Perubahan Iklim,2019-09-03T09:00:59+07:00,Liputan6.com,News,https://cdn1-production-images-kly.akamaized.net/SI6xmLK3_o8I8YYPAT8GvupxIAQ=/673x379/smart/filters:quality(75):strip_icc():format(jpeg)/kly-media-production/medias/2899717/original/018490500_1567426625-kantor_wali_kota_palembang.jpg,Kementrian Lingkungan Hidup dan Kehutanan (KLHK) merekomendasikan Kota Palembang Sumsel sebagai pilot project lokasi Rencana Aksi Perubahan Iklim.,"Kementrian Lingkungan Hidup dan Kehutanan, Perubahan Iklim, Rencana aksi perubahan iklim, Sumsel, Palembang","Liputan6.com, Palembang - Kota Palembang, Sumatera Selatan (Sumsel) menjadi salah satu kawasan di Indonesia, yang menjadi pilot project Rencana Aksi Perubahan Iklim. Program ini didukung oleh United Cities and Local Goverments Asia Pacific (UCLG ASPAC).
Kolaborasi antara Pemerintah Kota (Pemkot) Palembang dan delegasi UCLG ASPAC ini dibahas di Ruang Rapat II Setda Kota Palembang, Senin (2/9/2019). Turut hadir perwakilan Centre for Climate Risk and Opportunity Management in Southeast Asia Pasific (CCROB) dari Institut Pertanian Bogor (IPB).
Asisten II Sekretaris Daerah Kota Palembang Sinta Raharja mengatakan, perubahan iklim menjadi perhatian bersama dari seluruh kota. Pemkot Palembang berkomitmen dalam upaya mengatasi emisi dan perubahan iklim yang terjadi.


Baca Juga

Palembang Segera Operasikan Pembangkit Listrik Tenaga Sampah
Kementan Canangkan Palembang Jadi Kota Lumbung Pangan Nasional
KKP Bangun Pasar Ikan Modern Senilai Rp 22 Miliar di Palembang





""Terima kasih Palembang direkomendasikan sebagai salah satu kota yang menjadi pilot project. Palembang siap untuk melakukan pemulihan demi keberlangsungan hidup dan warisan iklim yang baik bagi anak cucu kita nanti,"" ujarnya.
Analisa dan penilaian yang dilakukan UCLG ASPAC, diharapkan memberikan kontribusi positif bagi kemajuan dan pembangunan Kota Palembang. Penyamaan langkah antar kota yang menjadi pilot project di Indonesia, menjadi sangat penting untuk kesuksesan program ini.
Menurut perwakilan UCLG ASPAC Riza Iskandar, para wali kota (wako) di Indonesia selama ini bertanya terkait dampak negatif perubahan iklim. Karena dinilai, komitmen untuk menekan low carbon itu adalah level kota bukan negara.
UCLG ASPAC yang merupakan satu-satunya organisasi pemerintah kota yang diakui dunia turut mendukung rencana ini.
“Di Asia Tenggara khususnya di Indonesia, kami berkoordinasi dengan Kementrian Lingkungan Hidup dan Kehutanan (KLHK) dan direkomendasikan Kota Palembang sebagai pilot project rencana aksi iklim,"" ujarnya.
Rekomendasi untuk berkoordinasi erat dengan pemerintah kota yang bersangkutan, agar mendapatkan latar belakang perubahan iklim yang sedetil mungkin. Mereka pun turut menggandeng CCROM IPB untuk melaksanakan program ini.
""Harapan Palembang untuk menyatukan komitmen bersama dengan kota lainnya, akan dijadikan masukan dan dijadwalkan di tingkat pusat,"" katanya.
 2 dari 2 halamanEmisi Rumah KacaAsisten II Sekretaris Daerah Kota Palembang Sinta Raharja saat memimpin rapat koordinasi Rencana Aksi Perubahan Iklim (Dok. Humas Pemkot Palembang / Nefri Inge)Perwakilan CCROM IPB Muhammad Ardiansyah mengungkapkan, mereka akan mencaritahu berapa tingkat emisi gas rumah kaca. Baik dari sektor industri, transportasi, perkebunan, pertanian, perikanan dan limbah.
Dari sektor ini akan diketahui sektor mana yang memberikan kontribusi terbesar terhadap efek gas rumah kaca.
""Kita juga akan melakukan analisis kerentanan terhadap Kota Palembang. Dimulai dengan menetapkan indikator yang berpotensi menyebabkan kerentanan di Palembang,"" ucapnya.
Tahapan pertama yaitu membentuk kelompok kerja dengan Sumber Daya Manusia (SDM), yang berkaitan dengan sektor yang di analisa.
Setelah semua data terhitung, akan dilakukan perbandingan emisi rumah tangga setiap tahunnya. Tim CCROM IPB juga akan melakukan analisa tingkat kerentanan hingga di tingkat kelurahan.
""Perubahan iklim itu pasti akan terjadi. Bagaimana menguranginya agar tidak terjadi kenaikan suhu hingga dua derajat celcius. Jika terjadi akan menyebabkan kita sulit beradaptasi,"" katanya.
Simak video pilihan berikut:simak video pilihan iniSelanjutnya: Emisi Rumah Kaca",palembang kota palembang sumatera selatan sumsel salah kawasan indonesia pilot project rencana aksi ubah iklim program dukung united cities and local goverments asia pacific uclg aspac kolaborasi perintah kota pemkot palembang delegasi uclg aspac bahas ruang rapat ii setda kota palembang senin hadir wakil centre for climate risk and opportunity management in southeast asia pasific ccrob institut tani bogor ipb asisten ii sekretaris daerah kota palembang sinta raharja ubah iklim perhati kota pemkot palembang komitmen upaya emisi ubah iklim baca palembang operasi bangkit listrik tenaga sampah tan canang palembang kota lumbung pangan nasional kkp bangun pasar ikan modern nila rp miliar palembang terima kasih palembang rekomendasi salah kota pilot project palembang laku pulih langsung hidup waris iklim anak cucu analisa nilai laku uclg aspac harap kontribusi positif maju bangun kota palembang langkah kota pilot project indonesia sukses program wakil uclg aspac riza iskandar wali kota wako indonesia kait dampak negatif ubah iklim nilai komitmen tekan low carbon level kota negara uclg aspac rupa organisasi perintah kota dunia dukung rencana asia tenggara khusus indonesia koordinasi tri lingkung hidup hutan klhk rekomendasi kota palembang pilot project rencana aksi iklim rekomendasi koordinasi erat perintah kota sangkut latar ubah iklim sedetil gandeng ccrom ipb laksana program harap palembang komitmen kota masuk jadwal tingkat pusat halamanemisi rumah kacaasisten ii sekretaris daerah kota palembang sinta raharja pimpin rapat koordinasi rencana aksi ubah iklim dok humas pemkot palembang nefri inge wakil ccrom ipb muhammad ardiansyah mencaritahu tingkat emisi gas rumah kaca sektor industri transportasi kebun tani ikan limbah sektor sektor kontribusi hadap efek gas rumah kaca laku analisis rentan hadap kota palembang indikator potensi rentan palembang tahap bentuk kelompok kerja sumber daya manusia sdm kait sektor analisa data hitung laku banding emisi rumah tangga tim ccrom ipb laku analisa tingkat rentan tingkat lurah ubah iklim suhu derajat celcius sulit adaptasi simak video pilih simak video pilih iniselanjutnya emisi rumah kaca
