web-scraper-order,web-scraper-start-url,link,link-href,title,date,author,category,image-url,description,keywords,text,processed
1580970896-31,https://www.liputan6.com/tag/perubahan-iklim?type=text&filter=all&page=3,"Waspada, Perubahan Iklim Bawa Kembali 5 Penyakit Purba Berbahaya Ini",https://www.liputan6.com/global/read/4032203/waspada-perubahan-iklim-bawa-kembali-5-penyakit-purba-berbahaya-ini,"Waspada, Perubahan Iklim Bawa Kembali 5 Penyakit Purba Berbahaya Ini",2019-08-07T21:00:01+07:00,Liputan6.com,News,https://cdn1-production-images-kly.akamaized.net/AmWFktGN-7foNG4Tzbm_7FjbQdA=/673x379/smart/filters:quality(75):strip_icc():format(jpeg)/kly-media-production/medias/1706622/original/049250100_1505121306-ternakkambingcov.jpg,5 penyakit berbahaya yang dibawa oleh perubahan iklim.,"Raja Organic, Jakarta, Sains, Penyakit, Perubahan Iklim","Liputan6.com, Jakarta - Dampak pemanasan global -- yang dikenal sebagai perubahan iklim -- dapat diamati dan kini telah dirasakan di mana-mana di Bumi.
Mulai dari cuaca ekstrem hingga naiknya permukaan air laut, masalah ini menjadi sangat nyata dan beberapa negara di seluruh dunia berjanji untuk mengurangi emisi gas rumah kaca di dalam negeri masing-masing.
Dampak paling dramatis dari perubahan iklim dapat disaksikan di Kutub Utara. Dengan pemanasan dua kali lipat rata-rata global, es di Laut Arktik menyusut setiap tahun dan Lapisan Es Greenland menjadi tidak stabil.


Baca Juga

Iklim Bumi Kian Panas, Sekjen PBB Desak Semua Negara Kurangi Suhu 1,5 Derajat Celcius
28 Perusahaan Dunia Berkomitmen Kurangi Suhu Global 1,5 Derajat Celcius
Wilayah Kering Australia Tiba-tiba Dilanda Salju, Efek Perubahan Iklim?





Mungkin salah satu perubahan signifikan di daerah tersebut terjadi di bawah tanah di lapisan es, lapisan tanah beku yang mencakup lebih dari 25% belahan Bumi utara.
Es di sana perlahan-lahan mencair sejak tahun 1980-an, mikroba purba kembali aktif, termasuk agen infeksi, virus dan spora kuno yang biasanya berakhir di persediaan air, tanah, dan sumber makanan manusia.
Berikut 5 penyakit berbahaya yang 'dibangkitkan kembali' oleh perubahan iklim, seperti dikutip dari Top Tenz, Rabu (7/8/2019).2 dari 7 halaman1. Virus PurbaIlustrasi virus. (Sumber Pixabay)Selama 2013 dan 2014 para ilmuwan menemukan dua virus raksasa di permafrost (lapisan tanah bagian bawah yang tebal, yang tetap beku sepanjang tahun) di Siberia.
Virus-virus tersebut, Pithovirus sibericum dan Mollivirus sibericum, sangat besar sehingga dapat dilihat di bawah mikroskop biasa.
Setelah dicairkan, virus-virus ini segera menjadi infeksius, sekaligus menjadi pengingat bahwa virus-virus yang berasal dari kehidupan Siberia kuno juga mungkin hidup kembali ketika permafrost mencair.
Saat ini, sebagian besar wilayah itu sepi dan lapisan permafrost yang lebih dalam, tidak terdampak. Namun, karena es yang meleleh, pantai utara Siberia menjadi lebih mudah diakses.3 dari 7 halaman2. Bakteri KunoVirus HIV AIDSNASA tidak hanya mempekerjakan insinyur dan astronaut, badan antariksa ini juga memiliki beberapa program penelitian di mana para ahli astrobiologi mengeksplorasi potensi kehidupan di Mars.
Selain itu, mereka pun meriset mengenai pembekuan kriogenik (pengetahuan tentang suhu yang sangat rendah) dan bagaimana manusia dapat mencapai (dan bertahan) selama perjalanan panjang menuju Planet Merah.
Ketika mencari Psychrophiles di lapisan es yang ditemukan di Mars --organisme yang hanya dapat ditemukan di suhu yang sangat rendah-- astrobiolog NASA, Dr. Richard Hoover, menemukan bakteri yang telah membeku selama 32.000 tahun.
Setelah dikeluarkan dari lapisan es dan bongkahan tersebut, bakteri itu hidup kembali, seolah-olah tidak pernah beku. Usai menjalani pengujian lebih lanjut, NASA menyimpulkan bahwa mereka telah menemukan bentuk kehidupan baru di Mars.
Pada 2017, para ilmuwan di Meksiko juga menemukan bakteri di sebuah lokasi penambangan yang mungkin umurnya jauh lebih tua.
Bakteri ini terperangkap di dalam kantong cairan kristal. Mikroba tersebut juga dihidupkan kembali dan mulai berkembang biak setelah dikeluarkan dari bungkus kuno itu.
Selama tes lebih lanjut, para ilmuwan terkejut karena menemukan bahwa bakteri itu resisten terhadap 18 jenis antibiotik. 4 dari 7 halaman3. BotulismeIlustrasi Human Immunodeficiency Virus (HIV) (iStock)Botulisme adalah penyakit langka yang disebabkan oleh toksin Botulinum, salah satu agen paling mematikan yang diketahui umat manusia.
Toksin itu menyebabkan kelumpuhan otot dan biasanya, pada penderita, timbul kesulitan berbicara dan menelan makanan atau minuman, sebelum akhirnya melumpuhkan seluruh tubuh.
Intervensi medis tidak menjamin kelangsungan hidup penderitanya, tetapi tanpa pengobatan, penyakit ini mampu membunuh dengan tingkat keampuhan 50%.
Sama seperti bakteri Anthrax, Botulinum membentuk spora yang dapat dan telah bertahan hidup di lapisan es selama lebih dari seabad --yang merupakan ancaman nyata begitu es mencair.
Spora dapat berakhir di tanah, debu dan air tawar dan sedimen laut, di mana wabah dapat merebak. Selama wabah menjangkit unggas dan ikan, bangkai hewan yang mati menjadi bagian dari siklus makanan saat mereka dimangsa belatung.
Spora juga dapat berakhir di sistem air tawar atau daerah baru yang sebelumnya tidak terdampak.
Pada tahun 1998, Danau Erie telah terdeteksi wabah Botulisme tahunan dan sekarang diperkirakan akan bermula dari Great Lakes.5 dari 7 halaman4. Kusta dan TBCilustrasi TBC (sumber: iStockphoto)Kusta dan tuberkulosis adalah penyakit yang lumrah mewabah pada Abad ke-1. Meskipun kedua penyakit ini masih ada sampai sekarang, masa inkubasinya yang panjang (kadang-kadang bisa hingga 20 tahun).
Agen penyebab tuberkulosis dan kusta, mikobakteri, sangat ulet dan tumbuh lambat, serta tidak memiliki reservoir (semacam tempat bersembunyi) lingkungan yang diketahui.
Sebagian besar DNA yang ditemukan sampai sekarang berasal dari kuburan abad pertengahan di Eropa. Namun, baru-baru ini, bukti DNA dari mikobakteri tuberkulosis telah ditemukan dari bangkai bison yang ditemukan di lapisan es yang berusia lebih dari 17.000 tahun.
 6 dari 7 halaman5. SmallpoxWaspada Cacar Monyet Yang Ditularkan Hewan LiarPada tahun 1890-an, Siberia terjangkit wabah cacar besar-besaran. Ratusan mayat yang terinfeksi, dikuburkan di bawah lapisan permafrost sebelah Sungai Kolyma.
Setelah lebih dari seratus tahun, genangan air sungai --dipercepat oleh pencairan lapisan es-- kini mulai mengikis tepi-tepi tempat mayat-mayat itu dikuburkan.
Sebuah tim peneliti mengakuisisi dan menyusun kembali seluruh urutan DNA genom dari tubuh seorang anak yang meninggal pada Abad ke-17, membenarkan bahwa Smallpox atau cacar monyet belum diberantas dari planet ini, hanya dari permukaannya saja.
Pada 1980, hanya beberapa bulan setelah kasus kematian terakhir, Organisasi Kesehatan Dunia (WHO) menyatakan bahwa Smallpox telah diberantas.
Saat ini, satu-satunya induk virus yang ""resmi"" dapat ditemukan hanya ada di dua tempat, yakni Pusat Pengendalian dan Pencegahan Penyakit AS (CDC) di Atlanta, Georgia, dan di VECTOR dekat Novosibirsk, Rusia.
Namun, ada induk lain yang ditemukan di Bethesda, Maryland pada tahun 2014, tanpa alasan jelas. Selain itu, virus ini dianggap sebagai agen bioterorisme.7 dari 7 halamanSaksikan video pilihan di bawah ini:Cacar monyet dan cacar biasa hampir nampak sama. Namun bila diteliti, ciri-ciri saat terjangkit cacar monyet punya berbedaan yang khas.Selanjutnya: 1. Virus Purba",jakarta dampak panas global kenal ubah iklim bumi cuaca ekstrem muka air laut nyata negara dunia janji emisi gas rumah kaca negeri dampak dramatis ubah iklim saksi kutub utara panas kali lipat global es laut arktik susut lapis es greenland stabil baca iklim bumi kian panas sekjen pbb desak negara suhu derajat celcius usaha dunia komitmen suhu global derajat celcius wilayah kering australia landa salju efek ubah iklim salah ubah signifikan daerah tanah lapis es lapis tanah beku cakup bahan bumi utara es cair mikroba purba aktif masuk agen infeksi virus spora kuno sedia air tanah sumber makan manusia sakit bahaya ubah iklim kutip top tenz rabu virus purbailustrasi virus sumber pixabay ilmuwan temu virus raksasa permafrost lapis tanah tebal beku siberia pithovirus sibericum mollivirus sibericum lihat mikroskop cair infeksius hidup siberia kuno hidup permafrost cair wilayah sepi lapis permafrost dampak es leleh pantai utara siberia mudah bakteri kunovirus hiv aidsnasa kerja insinyur astronaut badan antariksa milik program teliti ahli astrobiologi eksplorasi potensi hidup mars riset kena beku kriogenik suhu rendah manusia capai tahan jalan tuju planet merah cari psychrophiles lapis es temu mars organisme temu suhu rendah astrobiolog nasa richard hoover temu bakteri beku lapis es bongkah bakteri hidup beku jalan uji nasa simpul temu bentuk hidup mars ilmuwan meksiko temu bakteri buah lokasi tambang umur tua bakteri perangkap kantong cair kristal mikroba hidup kembang biak bungkus kuno tes ilmuwan kejut temu bakteri resisten hadap jenis antibiotik botulismeilustrasi human immunodeficiency virus hiv istock botulisme sakit langka toksin botulinum salah agen mati umat manusia toksin lumpuh otot derita timbul sulit bicara tel makan minum lumpuh tubuh intervensi medis jamin langsung hidup derita obat sakit bunuh tingkat ampuh bakteri anthrax botulinum bentuk spora tahan hidup lapis es abad rupa ancam nyata es cair spora tanah debu air tawar sedimen laut wabah rebak wabah jangkit unggas ikan bangkai hewan mati siklus makan mangsa belatung spora sistem air tawar daerah dampak danau erie deteksi wabah botulisme great kusta tbcilustrasi tbc sumber istockphoto kusta tuberkulosis sakit lumrah wabah abad sakit inkubasi agen tuberkulosis kusta mikobakteri ulet tumbuh lambat milik reservoir sembunyi lingkung dna temu kubur abad eropa bukti dna mikobakteri tuberkulosis temu bangkai bison temu lapis es usia smallpoxwaspada cacar monyet tular hewan liarpada siberia jangkit wabah cacar ratus mayat infeksi kubur lapis permafrost belah sungai kolyma ratus genang air sungai cepat cair lapis es kikis kubur buah tim teliti akuisisi susun urut dna genom tubuh orang anak tinggal abad smallpox cacar monyet berantas planet muka mati organisasi sehat dunia who nyata smallpox berantas induk virus resmi temu pusat kendali cegah sakit as cdc atlanta georgia vector novosibirsk rusia induk temu bethesda maryland alas virus anggap agen halamansaksikan video pilih cacar monyet cacar nampak teliti jangkit cacar monyet beda virus purba
1580970909-32,https://www.liputan6.com/tag/perubahan-iklim?type=text&filter=all&page=6,"Wali Kota Risma Jadi Pembicara Teroris di New York, Pulangnya Terima Penghargaan di Nairob...",https://www.liputan6.com/regional/read/3648915/wali-kota-risma-jadi-pembicara-teroris-di-new-york-pulangnya-terima-penghargaan-di-nairobi,"Wali Kota Risma Jadi Pembicara Teroris di New York, Pulangnya Terima Penghargaan di Nairobi",2018-09-21T13:01:08+07:00,Liputan6.com,News,https://cdn0-production-images-kly.akamaized.net/HlasOeXMlpVk-v2gDuR2YyzrJ90=/673x379/smart/filters:quality(75):strip_icc():format(jpeg)/kly-media-production/medias/965967/original/072470500_1440484607-risma3.jpg,Kunjungan ke luar negeri itu akan dimulai pada 22 September-3 Oktober 2018 ke New York dan Nairobi.,"newyork, Perubahan Iklim, Surabaya, Walikota Risma","Liputan6.com, Surabaya - Wali Kota Surabaya Tri Rismaharini akan menjadi pembicara di berbagai event internasional. Bahkan, ia juga akan menerima penghargaan tokoh dunia.
Kunjungan ke luar negeri itu akan dimulai pada 22 September sampai 3 Oktober 2018. Diawali terbang ke New York dan diakhiri ke Nairobi, Kenya. Di New York, Wali Kota Risma akan menjadi pembicara pada Global Counter Terrorism Forum di New York.
""Yang mengadakan acara ini Pemerintah Belanda,"" kata Wali Kota Risma di ruang kerjanya, Surabaya, Kamis 20 September 2018.


Baca Juga

Tiap Tahun Walikota Risma Bakal 'Tendang' 10 Bocah Surabaya ke Liverpool
Bangunan Mirip Candi Tempat Orang Suci Ditemukan di Lereng Gunung Wilis
Asal-usul Nama Jalan Gunungsari Surabaya yang Bakal Diganti Nama Siliwangi





Selanjutnya, Wali Kota Risma akan menjadi pembicara acara One Planet Summit di New York pada 26 September 2018. Dalam event ini, ia merupakan satu-satunya wali kota yang menjadi pembicara.
""Nanti, topiknya disitu tentang perubahan iklim,"" ujarnya.
Setelah acara itu, ia mengaku ingin pulang dulu ke Surabaya, tapi karena dia mendapatkan penghargaan, ia akan langsung menuju ke Nairobi. Di sana, Risma akan menerima penghargaan Scroll of Honor UN Habitat yang merupakan penghargaan tokoh dunia yang sangat berpengaruh.
""Yang memberikan ini di bawah UN Habitat langsung, makanya nanti mereka memberikan penghargaan di kantor pusat UN Habitat. Mereka memberikan penghargaan atas perubahan iklim, sebagai arsitek kota dan lainnya. Ini yang kasik rekom juga IAI (Ikatan Arsitek Indonesia),"" kata Risma.2 dari 2 halamanDari Belgia ke Korea UtaraSelasai acara di atas, Wali Kota Risma akan pulang dulu ke Surabaya dan berangkat lagi tanggal 6 Oktober 2018. Sebab, keesokan harinya, 7 Oktober 2018, Wali Kota yang sarat prestasi ini akan menjadi pembicara pada Bridges for Cities dengan topic Cities of Tomorrow: Technological Solutions and Holistic Approach for Sustainable Citiesdi Vienna, Austria.
""Mereka itu ngundangnya sudah satu tahun lalu. Nanti saya akan berbicara masalah bahan-bahan untuk Sustainable Development. Saya berbiara bahan-bahan itu sudah berkali-kali, termasuk juga ketika bertemu dengan Pangeran Charles,"" ujarnya.
Risma menuturkan, sebenarnya pada tanggal 10 Oktober 2018 itu dirinya dijadwalkan menjadi pembicara di Brussels, Belgia. Tapi, acara ini masih akan dicek lagi karena waktu di Vienna berbicara pada sore hari.
""Sebenarnya, di sana saya akan menjadi pembicara pada IUC City to City Event dengan topic penangananGlobal Warming dan Global Covenant Of Mayors karena board member Global Covenant of Mayors,"" kata dia.
Kunjungan ke luar negeri berikutnya yaitu ke Korea Utara pada tanggal 12 Oktober 2018. Dalam kunjungan kali ini, ia bertindak sebagai Presiden UCLG ASPAC, sehingga nantinya akan bertemu dengan wali kota-wali kota dan kepala daerah untuk berdiskusi tentang program UCLG ASPAC ke depannya dan apa saja yang perlu diprioritaskan.
""Nanti ketemu dengan mereka itu, akan membicarakan apa yang bisa dikerjakan atau tidak bisa dikerjakan. Karena semua negara peraturannya berbeda-beda dan tidak mesti sama,"" ujar Risma.
Saksikan video pilihan berikut ini:Kejadian ledakan bom di beberapa lokasi di Surabaya, membuat Walikota Surabaya melakukan sidak ke beberapa gereja.Selanjutnya: Dari Belgia ke Korea Utara",surabaya wali kota surabaya tri rismaharini bicara event internasional terima harga tokoh dunia kunjung negeri september oktober terbang new york nairobi kenya new york wali kota risma bicara global counter terrorism forum new york acara perintah belanda wali kota risma ruang kerja surabaya kamis september baca walikota risma bocah surabaya liverpool bangun candi orang suci temu lereng gunung wilis nama jalan gunungsari surabaya ganti nama siliwangi wali kota risma bicara acara one planet summit new york september event rupa wali kota bicara topik situ ubah iklim acara pulang surabaya harga langsung tuju nairobi risma terima harga scroll of honor un habitat rupa harga tokoh dunia pengaruh un habitat langsung harga kantor pusat un habitat harga ubah iklim arsitek kota kasik rekom iai ikat arsitek indonesia halamandari belgia korea utaraselasai acara wali kota risma pulang surabaya berangkat tanggal oktober esok oktober wali kota sarat prestasi bicara bridges for cities topic cities of tomorrow technological solutions and holistic approach for sustainable citiesdi vienna austria ngundangnya bicara sustainable development biara masuk temu pangeran charles risma tanggal oktober jadwal bicara brussels belgia acara cek vienna bicara sore bicara iuc city to city event topic penangananglobal warming global covenant of mayors board member global covenant of mayors kunjung negeri korea utara tanggal oktober kunjung kali tindak presiden uclg aspac temu wali kota kepala daerah diskus program uclg aspac prioritas ketemu bicara kerja kerja negara atur mesti risma saksi video pilih ledak bom lokasi surabaya walikota surabaya laku sidak belgia korea utara
