web-scraper-order,web-scraper-start-url,link,link-href,title,date,author,category,image-url,description,keywords,text,processed
1580971585-90,https://www.liputan6.com/tag/perubahan-iklim?type=text&filter=all&page=2,Demonstran Perubahan Iklim Blokade Kantor Pusat BBC di London,https://www.liputan6.com/global/read/4084167/demonstran-perubahan-iklim-blokade-kantor-pusat-bbc-di-london,Demonstran Perubahan Iklim Blokade Kantor Pusat BBC di London,2019-10-11T17:01:38+07:00,Liputan6.com,News,https://cdn1-production-images-kly.akamaized.net/lezR3nploG57Hsm6sW9j4uAUvpg=/673x379/smart/filters:quality(75):strip_icc():format(jpeg)/kly-media-production/medias/2933816/original/004803700_1570535773-20191008-Aktivis-Iklim-4.jpg,"Kantor BBC di London, Inggris diblokade pengunjuk rasa Extinction Rebellion pada Jumat pagi (11/10/2019).","demonstrasi, Perubahan Iklim, Inggris, london","Liputan6.com, Inggris - Pengunjuk rasa Extinction Rebellion memblokade kantor BBC di London, Inggris pada Jumat (11/10/2019) pagi waktu setempat.
Mereka berkumpul di depan kantor sembari meneriakkan protes atas perubahan iklim yang terjadi. ""BBC, tidak bisakah kau lihat, ini darurat,"" kata kerumunan demonstran.

Baca Juga
Virus Corona Kian Menyebar, Inggris Minta Warganya Angkat Kaki dari China



Pekerja di kantor pusat dilaporkan tidak bisa masuk. Hal itu karena kelompok tersebut berdiri di depan pintu masuk sambil mengibarkan spanduk dan bendera, seperti dilansir thesun.co.uk. 
Berdasarkan laporan, BBC tidak mengizinkan siapapun masuk atau keluar dari gedung kantor. Seorang juru bicara BBC mengonfirmasi bahwa mereka mengetahui protes yang terjadi saat dihubungi media Inggris, The Sun.
Sekitar 40 orang membawa 'peperangan' demonstran ke Beeb (sebutan untuk BBC) pagi ini. Disertai spanduk bertuliskan ""Planet Before Profit"" dan ""This is an emergency"".
Sementara itu, hari ini menandai hari kelima demonstrasi kelompok perubahan iklim. Bertepatan dengan pengunjuk rasa melanjutkan dua minggu pembangkangan sipil di Inggris.
Para pengunjuk rasa sudah berkemah pada jalan-jalan di sekitar Parliament Square dan Whitehall sejak Senin. 
Mereka menyerukan tindakan segera terhadap perubahan iklim serta satwa liar. Bahkan, mereka menyita delapan truk bermuatan hingga 10 ton, berisi generator, sumber listrik, toilet, tenda, dan peralatan tidur.2 dari 5 halamanTindakanIlustrasi Polisi Inggris (AFP)Sebanyak 500 polisi dari Inggris dan Wales telah dibawa untuk membantu mengatasi protes.
Kepolisian mengatakan sebelumnya ada seorang pemrotes Extinction Rebellion menempelkan dirinya di puncak pesawat British Airways di Bandara London City. Hal tersebut berbarengan jumlah total penangkapan mencapai 1.000 orang.
Pria itu merupakan Extinction Rebellion yang diidentifikasi sebagai pesepeda Paralimpik, James Brown. Dalam sebuah video yang disiarkan secara online oleh kelompok protes, Ia berpegangan pada sebuah pesawat.
Komisaris Metropolitan, Dame Cressida Dick menyebut tindakan James Brown adalah ""sembrono, bodoh, dan berbahaya"". 
""Pemahaman awal saya adalah seseorang telah ditangkap setelah mereka ... mungkin membeli tiket, melewati keamanan dengan sangat normal, naik tangga pesawat dan melemparkan diri mereka di atas pesawat,"" kata Cressida.
""Sebenarnya, itu adalah hal yang sembrono, bodoh, dan berbahaya untuk dilakukan bagi semua yang berkepentingan. Tapi saya pikir Anda dapat melihat bahwa itu adalah hal yang cukup sulit untuk diprediksi atau berhenti terjadi,"" tambah Komisioner.
Demonstrasi kemarin terfokus pada Bandara Kota London. Hal itu dilakukan para pemrotes seolah berusaha melakukan ""pendudukan gedung terminal bergaya Hong Kong"" dengan ratusan orang menghalangi pintu masuk utama bandar udara tersebut.3 dari 5 halamanUpaya Memblokade BandaraSeorang pria memainkan gitar saat aktivis iklim berkemah di Whitehall, London, Inggris, Selasa (8/10/2019). Protes global oleh gerakan Pemberontakan Kepunahan menuntut tindakan yang lebih mendesak untuk melawan perubahan iklim. (AP Photo/Alastair Grant) (AP Photo/Hibah Alastair)Pejuang lingkungan memblokir jalan masuk, naik ke atap terminal, hingga menempelkan diri ke pintu masuk stasiun DLR yang melayani bandara London Timur.
Pada jam 8 malam kemarin, Polisi Metropolitan mengatakan ada 1.112 penangkapan sejak dimulainya demonstrasi pada Senin. Termasuk 50 penangkapan di bandara kemarin.
Dame Cressida bersikeras Scotland Yard memiliki cukup sel untuk menampung dan memproses hukum semua aktivis.
Ia menambahkan petugas polisi diambil dari penanggulangan kejahatan pisau atau perlindungan anak-anak untuk mengawasi demonstrasi yang berlangsung. 
Dame mengatakan para pemrotes ""sama sekali tidak bertanggung jawab dan sama sekali tidak masuk akal."" Hal itu karena tekad mereka untuk mengambil alih jalan-jalan utama di London dalam periode dua minggu.
Ia mengatakan kepada pejuang lingkungan untuk berdemonstrasi pada area pejalan kaki di Lapangan Trafalgar. 
""Protes sesuai hukum atau pulang,"" kata Dame Cressida.
Sementara itu, hanya dua penerbangan dibatalkan di bandara. Ttidak ada lagi pengunjuk rasa di luar terminal tak lama setelah jam 7 malam waktu setempat. 
Salah satu pendiri Extinction Rebellion, Gail Bradbrock, memuji demonstrasi sebagai kesuksesan.
""Saya pikir hal yang paling penting adalah kita memperingatkan orang-orang Inggris akan krisis yang sedang kita hadapi dan ancaman terhadap semua bentuk bisnis- seperti biasa,” kata Gail Bradbrock.4 dari 5 halamanAksi Nekat Aktivis James Brownilustrasi kejadian kriminalJames Brown yang tunanetra ditangkap di Heathrow bulan lalu setelah protes. Hal itu karena ia mencoba menerbangkan drone di dekat bandar udara.
Kemudian, mantan atlet Paralimpiade yang memenangkan medali perunggu di London 2012 tersebut, menempelkan dirinya di puncak jet BA Embraer 190.
Dalam sebuah video yang diposting online, ia mengatakan perasaan yang disertai umpatan pada pesan video. 
""Di sini saya di atas pesawat di City Airport. Aku benci ketinggian, aku berhasil naik atap, aku sangat gemetar,"" kata James Brown.
""Ini semua tentang krisis iklim dan ekologi, kami memprotes kelambanan pemerintah terhadap kerusakan iklim dan ekologi. Mereka menyatakan darurat iklim dan kemudian tidak melakukan apa-apa,"" ucap mantan atlet paralimpiade tersebut.
""Sebenarnya mereka pergi ke arah yang berlawanan, mereka mendukung perluasan bandara, Heathrow, Bristol, dan lainnya. Kita tidak bisa membiarkan ini berlangsung, kita tidak bisa memiliki kue dan memakannya,"" tambah James.
Tak lama, ia kemudian memperhatikan keamanan sedang mendekati dan mengharapkan mereka. 
""Oh, keamanan yang baik akan datang. Saya harap mereka tidak terlalu lama karena ini sangat menakutkan,"" tutup Brown. Akhirnya, James dipindahkan.
Sementara itu, seorang juru bicara untuk BA kemudian berkomentar perihal masalah yang terjadi akibat protes yang dilakukan James.
""Kami sedang menyelidiki apa yang terjadi sebagai masalah yang mendesak,"" kata juru bicara BA.
 
Reporter: Hugo Dimas5 dari 5 halamanSaksikan video pilihan di bawah ini:Seorang gadis Swedia yang merupakan aktivis lingkungan hidup berbicara tentang perubahan ilim di Parlemen Inggris. Ia telah mengawali aksinya untuk lingkungan sejak 2018Selanjutnya: Tindakan",inggris unjuk extinction rebellion blokade kantor bbc london inggris jumat pagi kumpul kantor sembari teriak protes ubah iklim bbc kau lihat darurat kerumun demonstran baca virus corona kian sebar inggris warga angkat kaki china kerja kantor pusat lapor masuk kelompok pintu masuk kibar spanduk bendera lansir dasar lapor bbc izin masuk gedung kantor orang juru bicara bbc konfirmasi protes hubung media inggris the sun orang bawa demonstran beeb bbc pagi spanduk tulis planet before profit this is an emergency tanda demonstrasi kelompok ubah iklim unjuk minggu bangkang sipil inggris unjuk kemah parliament square whitehall senin seru tindak hadap ubah iklim satwa liar sita delapan truk muat ton isi generator sumber listrik toilet tenda alat halamantindakanilustrasi polisi inggris afp polisi inggris wales bawa bantu protes polisi orang pemrotes extinction rebellion tempel puncak pesawat british airways bandara london city bareng total tangkap capai orang pria rupa extinction rebellion identifikasi sepeda paralimpik james brown buah video siar online kelompok protes gang buah pesawat komisaris metropolitan dame cressida dick tindak james brown sembrono bodoh bahaya paham orang tangkap beli tiket aman normal tangga pesawat lempar pesawat cressida sembrono bodoh bahaya laku ting pikir lihat sulit prediksi henti komisioner demonstrasi kemarin fokus bandara kota london laku pemrotes olah usaha laku duduk gedung terminal gaya hong kong ratus orang halang pintu masuk utama bandar udara halamanupaya blokade bandaraseorang pria main gitar aktivis iklim kemah whitehall london inggris selasa protes global gera ronta punah tuntut tindak desak lawan ubah iklim ap grant ap alastair juang lingkung blokir jalan masuk atap terminal tempel pintu masuk stasiun dlr layan bandara london timur jam malam kemarin polisi metropolitan tangkap demonstrasi senin masuk tangkap bandara kemarin dame cressida sikeras scotland yard milik sel tampung proses hukum aktivis tugas polisi ambil tanggulang jahat pisau lindung awas demonstrasi langsung dame pemrotes tanggung masuk akal tekad ambil alih utama london periode minggu juang lingkung demonstrasi area pejal kaki lapang trafalgar protes sesuai hukum pulang dame cressida terbang batal bandara ttidak unjuk terminal jam malam salah extinction rebellion gail bradbrock puji demonstrasi sukses pikir inggris krisis hadap ancam hadap bentuk gail halamanaksi nekat aktivis james brownilustrasi kriminaljames brown tunanetra tangkap heathrow protes coba terbang drone bandar udara mantan atlet paralimpiade menang medali perunggu london tempel puncak jet ba embraer buah video diposting online asa umpat pesan video pesawat city airport benci hasil atap gemetar james brown krisis iklim ekologi protes lamban perintah hadap rusa iklim ekologi nyata darurat iklim laku mantan atlet paralimpiade pergi arah lawan dukung luas bandara heathrow bristol biar langsung milik kue makan james perhati aman harap oh aman harap takut tutup brown james pindah orang juru bicara ba komentar perihal akibat protes laku james selidik desak juru bicara ba reporter hugo halamansaksikan video pilih orang gadis swedia rupa aktivis lingkung hidup bicara ubah ilim parlemen inggris aksi lingkung tindak
1580971600-91,https://www.liputan6.com/tag/perubahan-iklim?type=text&filter=all&page=1,PKB Usulkan RUU Perubahan Iklim di Prolegnas 2020,https://www.liputan6.com/news/read/4126626/pkb-usulkan-ruu-perubahan-iklim-di-prolegnas-2020,PKB Usulkan RUU Perubahan Iklim di Prolegnas 2020,2019-12-04T16:12:28+07:00,Liputan6.com,News,https://cdn1-production-images-kly.akamaized.net/FFnDhHGfbH16EMEhSBOaC5G-dtE=/673x379/smart/filters:quality(75):strip_icc():format(jpeg)/kly-media-production/medias/2986762/original/046791400_1575465488-WhatsApp_Image_2019-12-04_at_7.31.53_PM.jpeg,"PKB menilai, persoalan pemanasan global tidak bisa hanya menjadi komitmen salah satu stakeholder, tapi harus menyeluruh.","RUU Perubahan Iklim, Perubahan Iklim, PKB","Liputan6.com, Jakarta - Fraksi PKB DPR mengusulkan Rancangan Undang-Undang (RUU) Perubahan Iklim dalam Program Legislasi Nasional (Prolegnas) 2020. Langkah ini sejalan dengan komitmen PKB untuk selalu mendorong adanya regulasi hijau sesuai program politik hijau di PKB.
Hal itu disampaikan Sekjen DPP PKB M Hasanuddin Wahid dalam Diskusi Publik bertema Implementasi Paris Agreement #GreenPartyPKB Mendorong RUU Perubahan Iklim yang dipandu moderator Billy Ariez dari Climate Institute di Kantor DPP PKB, Jalan Raden Saleh, Jakarta Pusat, Rabu (4/12/2019)

Baca Juga
Politikus PKB Ini Minta Santri Aktif Jaga Indonesia dari Intoleransi



”Kita dorong seluruh undang-undang untuk perbaikan iklim. Bagaimana Indonesia menjadi garda terdepan dalam penanganan atas pemanasan global, produksi emisi dan terus menjadikan semua pembangunan di Indonesia ini menjadi ramah lingkungan, menjadi energi terbarukan dan sebagainya,” ujar Hasan.
Hasan mengatakan, untuk mewujudkan langkah tersebut diperlukan komitmen kuat baik di tingkat legislatif maupun eksekutif. Sebab, persoalan pemanasan global tidak bisa hanya menjadi komitmen salah satu stakeholder, tapi harus menyeluruh.
”Bahkan seperti yang sekarang Pak Ketua Umum (Muhaimin Iskandar) lakukan di Madrid, menyuarakan tentang itu bagaimana semua negara-negara di dunia ini mempunyai peran aktif untuk memproduksi emisi. Bagaimana agar pemanasan global ini tidak terjadi begitu masif dan kemudian seluruh paradigma pembangunan di semua negara itu harus ramah lingkungan,” urainya.
Indonesia, kata Hasan, diharapkan menjadi prototype bagi negara-negara lain, bagaimana agar pemanasan global dan perubahan iklim itu bisa dikelola dengan baik dan semakin hijau.
PKB juga sudah menginventarisir sejumlah undang-undang dalam “regulasi hijau” agar pembangunan ke depan betul-betul menjadikan lingkungan hidup tetap asri dan tidak terpapar pemanasan global.
Nantinya, RUU tersebut tidak hanya terkait pemanasan global saja, namun juga menyangkut undang-undang lain yang terkait. Misalnya terkait dengan pertahanan, pengelolaan minerba, dan sebagainya.
”Jadi dengan undang-undang tersebut itu tidak justru ada undang undang kebijakan yang itu justru kemudian berkontribusi negatif terhadap lingkungan hidup,” urainya.
Termasuk di dalamnya menyangkut kemaritiman karena faktanya naiknya permukaan air laut seperti di Jakarta dan sejumlah daerah lainnya juga menjadi persoalan yang harus diatasi.
“PKB rutin diskusi dan sering ketemu stakeholders tentang lingkungan maka ini akan jadi bahan fraksi untuk mengajukan UU,” urainya.
 2 dari 3 halamanJadi Perhatian Sejak LamaAnggota Fraksi PKB DPR RI Ratna Juwita menambahkan, masalah perubahan iklim sudah menjadi perhatian PKB sejak lama dan menjadi salah satu usulan prioritas RUU untuk Prolegnas 2020.
Menurutnya, dalam usulan RUU Perubahan Iklim nantinya tidak berdiri sendiri. Namun, juga ada ada rancangan revisi Undang-Undang Minerba.
”Jadi seperti kita tahu ada 12 pasal yang sudah dibatalkan oleh Mahkamah Agung, itu kan tentunya pasti banyak sekali mudaratnya untuk masyarakat,” katanya.
Ratna menambahkan, dari kajian yang dilakukan PKB, dalam UU Minerba tidak ada klausul yang mengatur tentang tanah seperti lahan gambut yang di dalamnya terdapat microhydro. Selain itu, juga belum ada pidana untuk penggunaan merkuri dalam perusahaan pertambangan emas.
“Ini bagaimana positioning kita untuk membantu masyarakat yang lahannya itu digunakan untuk wilayah pertambangan. Jadi itu yang saya concern untuk revisi Undang Undang Minerba,” urainya.
Dalam mengajukan RUU Perubahan Iklim, PKB akan membicarakan dengan fraksi lainnya di DPR sehingga RUU ini bisa dibahas dan selanjutnya menjadi UU.
“Dan bagaimana isu ini bisa lebih diterima oleh masyarakat, artinya mereka semakin aware dengan perjuangan kita terkait perubahan iklim,” pungkasnya.3 dari 3 halamanSaksikan Video Pilihan di Bawah Ini:Hutan amazon di Brasil masih terbakar hebat di beberapa titik. Muncul kekhawatiran asap kebakaran akan memperburuk pemanasan global dan ancam kesehatan warga dunia.Selanjutnya: Jadi Perhatian Sejak Lama",jakarta fraksi pkb dpr usul rancang ruu ubah iklim program legislasi nasional prolegnas langkah jalan komitmen pkb dorong regulasi hijau sesuai program politik hijau pkb sekjen dpp pkb m hasanuddin wahid diskusi publik tema implementasi paris agreement greenpartypkb dorong ruu ubah iklim pandu moderator billy ariez climate institute kantor dpp pkb jalan raden saleh jakarta pusat rabu baca politikus pkb santri aktif jaga indonesia intoleransi dorong iklim indonesia garda tangan panas global produksi emisi bangun indonesia ramah lingkung energi hasan hasan wujud langkah komitmen kuat tingkat legislatif eksekutif panas global komitmen salah stakeholder ketua muhaimin iskandar laku madrid suara dunia peran aktif produksi emisi panas global masif paradigma bangun negara ramah lingkung urai indonesia hasan harap prototype panas global ubah iklim kelola hijau pkb menginventarisir regulasi hijau bangun lingkung hidup asri papar panas global ruu kait panas global sangkut kait kait tahan kelola minerba undang undang bijak kontribusi negatif hadap lingkung hidup urai masuk sangkut maritim fakta muka air laut jakarta daerah pkb rutin diskusi ketemu stakeholders lingkung bahan fraksi aju uu urai halamanjadi perhati lamaanggota fraksi pkb dpr ri ratna juwita ubah iklim perhati pkb salah usul prioritas ruu prolegnas usul ruu ubah iklim rancang revisi minerba pasal batal mahkamah agung mudarat masyarakat ratna kaji laku pkb uu minerba klausul atur tanah lahan gambut microhydro pidana merkuri usaha tambang emas positioning bantu masyarakat lahan wilayah tambang concern revisi undang undang minerba urai aju ruu ubah iklim pkb bicara fraksi dpr ruu bahas uu isu terima masyarakat arti aware juang kait ubah iklim halamansaksikan video pilih hutan amazon brasil bakar hebat titik muncul khawatir asap bakar buruk panas global ancam sehat warga perhati
1580971613-92,https://www.liputan6.com/tag/perubahan-iklim?type=text&filter=all&page=2,7 Dampak Perubahan Iklim yang Aneh dan Tak Terduga,https://www.liputan6.com/global/read/4100849/7-dampak-perubahan-iklim-yang-aneh-dan-tak-terduga,7 Dampak Perubahan Iklim yang Aneh dan Tak Terduga,2019-11-01T21:00:00+07:00,Liputan6.com,News,https://cdn1-production-images-kly.akamaized.net/WiBRAGvA8Rxhf1rg8W54HP5aFVU=/673x379/smart/filters:quality(75):strip_icc():format(jpeg)/kly-media-production/medias/744884/original/081235500_1412139136-climate-change-child-140930.jpg,"Perubahan iklim menyebabkan beberapa hal aneh terjadi, seperti berubahnya jenis kelamin bayi binatang.","Dampak Perubahan Iklim, Climate Change, Perubahan Iklim, DW","Jakarta - Perubahan iklim telah menjadi perhatian serius sejumlah aktivis lingkungan dunia. Di beberapa negara, demonstrasi mendesak langkah konkret untuk pencegahan dampak perubahan iklim terus disuarakan.
Perubahan iklim adalah ancaman langsung yang nyata. Tidak satu pun negara yang dapat terhindar dari dampak yang terjadi dan dibutuhkan upaya kolektif untuk menyikapinya.

Baca Juga
Cerita Warga Jerman dari Tempat Karantina Virus Corona



Dunia telah alami begitu banyak dampak buruk dari perubahan iklim, di mana aksi global untuk menguranginya tidaklah cukup.
Perubahan iklim menyebabkan beberapa hal aneh terjadi, seperti berubahnya jenis kelamin bayi binatang. Berikut ini dampak perubahan iklim yang tidak pernah diduga akan berakibat pada kehidupan di bumi, seperti dikutip dari DW, Jumat (1/11/2019):2 dari 9 halaman1. Ledakan Populasi Ubur-UburPengunjung melihat ubur-ubur di Wahana Jellyfish Sphere di SeaWorld Ancol, Jakarta, Selasa (25/12). Sea World menjadi tempat wisata alternatif warga menghabiskan libur Natal 2018. (Liputan6.com/Faizal Fanani)Meskipun ada kombinasi faktor di balik banyaknya ubur-ubur yang sampai ke tempat wisata seperti pantai Mediterania, perubahan iklim termasuk salah satunya.
Suhu laut yang lebih hangat membuka daerah baru bagi ubur-ubur bereproduksi dan meningkatkan ketersediaan makanan favorit mereka, yaitu plankton.3 dari 9 halaman2. Lenyapnya Kayu BerkualitasBiola langka 1684 buatan Antonio Stradivari saat diperkenalkan di Hong Kong (21/2). Biola terlangka di dunia ini diperkirakan berharga USD 1,550.000 sampai USD 2.450.000 atau sekitar Rp 20,6 miliar sampai Rp 32,5 milar. (AFP Photo / Isaac Lawrence)Dihargai karena kualitas suara yang superior, alat musik dawai Stradivarius asli dapat dijual jutaan dolar. Namun, perubahan cuaca ekstrem seperti badai yang luar biasa hebatnya berakibat tumbangnya jutaan pohon di hutan Paneveggio, Italia utara.
Menanam kembali pohon tidak akan banyak membantu dalam jangka pendek. Sebuah pohon cemara harus berusia setidaknya 150 tahun sebelum dapat menjadi biola.4 dari 9 halaman3. Kesulitan tidurIlustrasi tidur. Sumber foto: unsplash.com/Alexandra Gorn.Orang-orang di kota besar akan kesulitan tidur karena kepanasan. Tahun 2050, suhu di kota-kota besar Eropa akan lebih hangat 3,5 derajat celcius di musim panas.
Ini tidak hanya mempengaruhi tidur, tetapi juga suasana hati, produktivitas, dan kesehatan mental. Cara satu-satunya mengatasi ini adalah pindah ke kota kecil yang banyak tanaman hijau dan sedikit bangunan, membuat malam jadi lebih dingin.5 dari 9 halaman4. Mengancam Penderita AlergiDekorasi dan makanan selama Natal bisa memicu alergi (Ilustrasi: Mirror)Musim semi datang lebih awal pada 2019 dikarenakan suhu global yang lebih hangat. Namun fenomena ini jadi berita buruk bagi penderita alergi.
Musim dingin yang sebentar membuat tanaman memiliki waktu lebih untuk tumbuh, berkembang, dan menghasilkan serbuk sari yang akan bebas berkeliaran jauh lebih awal, sehingga membuat penderita alergi menderita lebih lama.6 dari 9 halaman5. Bakteri dan Nyamuk Berkembang BiakIlustrasi Foto Nyamuk (iStockphoto)Tidak hanya berkeringat, panas juga dapat mempengaruhi kesehatan manusia. Pada akhir abad ini, 3/4 populasi dunia diprediksi terkena gelombang panas yang berbahaya dan mematikan.
Naiknya suhu berdampak pada peningkatan penyakit diare, karena bakteri lebih mudah berkembang biak dalam makanan dan air hangat. Jumlah nyamuk juga kemungkinan akan naik, seiring dengan penyebaran penyakit seperti malaria.7 dari 9 halaman6. Rumah-Rumah HancurTornado menghantam Ohio dan Indiana, Amerika Serikat pada Selasa 28 Mei 2019, menewaskan 1 orang, melukai 130 lainnya, dan menyebabkan rumah-rumah hancur. (AP PHOTO)Tanah di sekitar Kutub Utara semakin mencair pada bulan-bulan di musim panas. Suhu yang lebih hangat menyebabkan tanah menjadi tidak stabil dan rumah-rumah serta jalan-jalan retak dan menyebabkan lebih banyak serangga.
Selain itu, jika permafrost (tanah beku) meleleh, ia akan melepaskan gas CO2 dan metana yang selanjutnya dapat memperburuk pemanasan global.8 dari 9 halaman7. Perubahan Jenis KelaminBayi penyu atau tukik sampak ke laut saat kelompok The Orange House Project melepaskan mereka di pantai El Mansouri, Tyre, Lebanon, Minggu (29/7). (Mahmoud ZAYYAT/AFP)Suhu mempengaruhi jenis kelamin beberapa spesies. Untuk penyu, panasnya pasir tempat telur diinkubasi menentukan jenis kelamin bayi yang baru lahir.
Temperatur rendah menguntungkan penyu jantan, sementara betina berkembang lebih baik di daerah yang lebih hangat. Peneliti membuktikan bahwa lebih dari 99% penyu di Australia utara sudah betina, sehingga sulit bagi spesies untuk bertahan hidup.9 dari 9 halamanSaksikan video pilihan di bawah ini:Islandia paringati punahnya Gletser bernama Okjokull yang resmi dinyatakan hilang bilang tahun 2014. Ancaman serupa akan dihadapi gletser-gletser lainnya dalam 200 tahun ke depan.Selanjutnya: 1. Ledakan Populasi Ubur-Ubur",jakarta ubah iklim perhati serius aktivis lingkung dunia negara demonstrasi desak langkah konkret cegah dampak ubah iklim suara ubah iklim ancam langsung nyata negara hindar dampak butuh upaya kolektif sikap baca cerita warga jerman karantina virus corona dunia alami dampak buruk ubah iklim aksi global ubah iklim aneh ubah jenis kelamin bayi binatang dampak ubah iklim duga akibat hidup bumi kutip dw jumat ledak populasi lihat wahana jellyfish sphere seaworld ancol jakarta selasa sea world wisata alternatif warga habis libur natal fanani kombinasi faktor wisata pantai mediterania ubah iklim masuk salah suhu laut hangat buka daerah reproduksi tingkat sedia makan favorit lenyap kayu berkualitasbiola langka antonio stradivari kenal hong kong biola langka dunia harga usd usd rp miliar rp milar afp photo isaac lawrence harga kualitas suara superior alat musik dawai stradivarius asli jual juta dolar ubah cuaca ekstrem badai hebat akibat tumbang juta pohon hutan paneveggio italia utara tanam pohon bantu jangka pendek buah pohon cemara usia sulit tidurilustrasi tidur sumber foto kota sulit tidur panas suhu eropa hangat derajat celcius musim panas pengaruh tidur suasana hati produktivitas sehat mental pindah kota tanam hijau bangun malam ancam derita alergidekorasi makan natal picu alergi ilustrasi mirror musim semi suhu global hangat fenomena berita buruk derita alergi musim dingin sebentar tanam milik tumbuh kembang hasil serbuk sari bebas liar derita alergi derita bakteri nyamuk kembang biakilustrasi foto nyamuk istockphoto keringat panas pengaruh sehat manusia abad populasi dunia prediksi kena gelombang panas bahaya mati suhu dampak tingkat sakit diare bakteri mudah kembang biak makan air hangat nyamuk iring sebar sakit hancurtornado hantam ohio indiana amerika serikat selasa mei tewas orang luka hancur ap photo tanah kutub utara cair musim panas suhu hangat tanah stabil retak serangga permafrost tanah beku leleh lepas gas metana buruk panas ubah jenis kelaminbayi penyu tukik sampak laut kelompok the orange house project lepas pantai el mansouri tyre lebanon minggu mahmoud suhu pengaruh jenis kelamin spesies penyu panas pasir telur inkubasi jenis kelamin bayi lahir temperatur rendah untung penyu jantan betina kembang daerah hangat teliti bukti penyu australia utara betina sulit spesies tahan halamansaksikan video pilih islandia paringati punah gletser nama okjokull resmi nyata hilang bilang ancam rupa hadap ledak populasi
